[
  {
    "name": "Ada",
    "status": "LOCKED (role) / AWAITING FRAGMENT (full dossier)",
    "known_facts": [
      "Field commander / scapegoat.",
      "Listed KIA before final blast confirmation.",
      "One of four Cape Wipeout survivors (with Tallai/Talla, Q, and Quartz).",
      "Named in the refined Nago plate's in-world Honor & Origin line as one of those who carried Nago.",
      "Full credited name per the Friedmandostorp rescue animatic: Adanna \"Ada\" Venter.",
      "Carries a necklace from Kassey — a simple silver chain with a small, solid heart pendant (Kemi, 2026-06-23). Kassey (KC) is confirmed the same entity as the animatic's \"Kassey\", the canonical spelling (visual source of truth).",
      "Kassey is Ada's lover — a man, a separate person (Kemi, 2026-06-23). His name burns across Ada's torn military record in the animatic. See 02_characters/KASSEY_DOSSIER.md.",
      "Sent by the Military Industrial Complex (MIC), with Kassey, to execute the Cape Wipeout blast that obliterates the facility (Kemi, 2026-06-23). Elaborates her locked field-commander/scapegoat role and the locked fact that the MIC destroys the facility.",
      "Appearance (Kemi, 2026-06-23): Nigerian; slim build. Long hair, default look slicked back in a ponytail; mangled in the blast (the animatic's 'A face first' beat). Other features open.",
      "Wears a military uniform — 'medium brass' (Kemi, 2026-06-23), read in the standard military sense as a mid-ranking officer, fitting her field-commander role.",
      "Personality (Kemi, 2026-06-23): under pressure, when things are coming apart, she goes cold and methodical, not loud. Voice and personality otherwise open.",
      "Locked visual reference (Kemi-approved, 2026-06-23): assets/concept-art/ADA_CHARACTER_REFERENCE_v1.png. Locks the 'medium brass' gloss to a woodland-pattern camo uniform with a name tape ('ADA'), gold collar rank insignia, a wings/pilot-style chest badge, a sleeve flag patch (design unspecified), a web belt with holstered sidearm and knife, and a wristwatch. See 13_fragments/2026-06-23_ada_reference_portrait.md."
    ],
    "open_question": "Does the wings/pilot-style badge in the locked reference image indicate an aviation background, or is it decorative? See 01_canon/OPEN_QUESTIONS.md #31.",
    "dossier_artifact": "Ada Character Dossier",
    "dossier_status": "IN PROGRESS — see 02_characters/ADA_DOSSIER.md (role facts and locked visual reference compiled, a few open fields awaiting Kemi)"
  },
  {
    "name": "Tallai / Talla",
    "status": "LOCKED (role) / OPEN QUESTION (preferred single spelling) / AWAITING FRAGMENT (full dossier)",
    "known_facts": [
      "Chimera care specialist.",
      "Known at the bread stop in Friedmandostorp before the blast.",
      "Explores the Garden (Era 4).",
      "One of four Cape Wipeout survivors.",
      "Named in the refined Nago plate's in-world Honor & Origin line as one of those who carried Nago."
    ],
    "open_question": "Both 'Tallai' and 'Talla' are attested across source documents. Whether this is a nickname/full-name pair or a spelling that should converge on one form is open — see 01_canon/OPEN_QUESTIONS.md.",
    "dossier_artifact": "Tallai Character Dossier",
    "dossier_status": "AWAITING FRAGMENT"
  },
  {
    "name": "Q",
    "status": "LOCKED (role) / AWAITING FRAGMENT (full dossier)",
    "known_facts": [
      "Detects — scout/sensing role (\"Q detects. Quartz carries.\").",
      "One of four Cape Wipeout survivors.",
      "Named in the refined Nago plate's in-world Honor & Origin line as one of those who carried Nago."
    ],
    "dossier_artifact": "Q Character Dossier",
    "dossier_status": "AWAITING FRAGMENT"
  },
  {
    "name": "Quartz",
    "status": "LOCKED (role) / AWAITING FRAGMENT (full dossier)",
    "known_facts": [
      "Carries — load-bearer / rescue anchor (\"Q detects. Quartz carries.\").",
      "One of four Cape Wipeout survivors.",
      "Not named in the refined Nago plate's in-world Honor & Origin line, which credits Tallai, Ada, Q, and \"the people\" — see open question in 01_canon/OPEN_QUESTIONS.md."
    ],
    "dossier_artifact": "Quartz Character Dossier",
    "dossier_status": "AWAITING FRAGMENT"
  },
  {
    "name": "Kassey",
    "status": "EMERGING (confirmed by Kemi) / DRAFT (full dossier)",
    "known_facts": [
      "Ada's lover — a man, a separate person from Ada (Kemi, 2026-06-23).",
      "Gave Ada the necklace she carries — a simple silver chain with a small, solid heart pendant (Kemi, 2026-06-23).",
      "Alive through Cape Wipeout (Kemi, 2026-06-23) — not the figure listed KIA; that is Ada's record.",
      "Sent by the Military Industrial Complex (MIC), with Ada, to execute the Cape Wipeout blast that obliterates the facility (Kemi, 2026-06-23). Elaborates the locked fact that the MIC destroys the facility.",
      "His name \"Kassey\" burns across Ada's torn military record in the Friedmandostorp rescue animatic, in a different, glowing script (March 19, 2226). The record itself is Ada's; its CLEARANCE DENIED / KIA stamps and Chimera Survivor / Scientist / Empath tags describe Ada, not Kassey.",
      "Canonical written form: Kassey (visual source of truth); KC is the short form."
    ],
    "open_question": "Appearance, his standing role beyond the blast mission, whether he and Ada acted willingly or under coercion, and what becomes of him after the blast are all open and not invented. See 02_characters/KASSEY_DOSSIER.md and 01_canon/OPEN_QUESTIONS.md #30.",
    "dossier_artifact": "Kassey Character Dossier",
    "dossier_status": "IN PROGRESS — see 02_characters/KASSEY_DOSSIER.md"
  },
  {
    "name": "Aisha",
    "status": "OPEN QUESTION (pending confirmation)",
    "known_facts": [],
    "open_question": "Named as 'KNOWN CANON' in a 2026-06-22 repository-restructuring brief, but absent from the source package, the realized plates, and every prior fragment. No role-facts or biographical detail exist. See 01_canon/OPEN_QUESTIONS.md.",
    "dossier_artifact": null,
    "dossier_status": "AWAITING FRAGMENT"
  },
  {
    "name": "Nayla",
    "status": "OPEN QUESTION (pending confirmation)",
    "known_facts": [],
    "open_question": "Named as 'KNOWN CANON' in a 2026-06-22 repository-restructuring brief, but absent from the source package, the realized plates, and every prior fragment. No role-facts or biographical detail exist. See 01_canon/OPEN_QUESTIONS.md.",
    "dossier_artifact": null,
    "dossier_status": "AWAITING FRAGMENT"
  },
  {
    "name": "Adeola",
    "status": "OPEN QUESTION (pending confirmation)",
    "known_facts": [],
    "open_question": "Named as 'KNOWN CANON' in a 2026-06-22 repository-restructuring brief, but absent from the source package, the realized plates, and every prior fragment. No role-facts or biographical detail exist. See 01_canon/OPEN_QUESTIONS.md.",
    "dossier_artifact": null,
    "dossier_status": "AWAITING FRAGMENT"
  }
]
